<?xml version="1.0" encoding="UTF-8"?>
<!ELEMENT objednavka (AdDoručeni, AdÚčtovací, ZpůsobDopravy, ZpůsobPlatby, DatumPřijetí, DatumDoručení, ObsahObjednávky, Komentář?)>
<!ELEMENT  AdDoručeni (Jméno,  Ulice, Město, PSČ)>
<!ELEMENT  AdÚčtovací (Jméno,  Ulice, Město, PSČ)>
<!ELEMENT  Jméno     (#PCDATA)>
<!ELEMENT  Ulice        (#PCDATA)>
<!ELEMENT  Město      (#PCDATA)>
<!ELEMENT  PSČ        (#PCDATA)>
<!ELEMENT ZpůsobDopravy (#PCDATA) >
<!ELEMENT ZpůsobPlatby (#PCDATA) >
<!ELEMENT  DatumPřijetí (#PCDATA)>
<!ELEMENT  DatumDoručení (#PCDATA)>
<!ELEMENT ObsahObjednávky (Zboží+) >
<!ELEMENT Zboží (Kód, Název, Počet, Cena, Popis?) >
<!ELEMENT  Kód (#PCDATA)>
<!ELEMENT Název (#PCDATA) >
<!ELEMENT  Počet (#PCDATA)>
<!ELEMENT Cena (#PCDATA) >
<!ELEMENT Popis (#PCDATA) >
<!ELEMENT Komentář (Řádka*) >
<!ELEMENT  Řádka (#PCDATA)>
<!ATTLIST Počet
                    jednotka      (ks | kg | m2 | m)      #IMPLIED>
